Job Title,Location,Company Name,Pay,Job Type,Description,Location or Zipcode,href
Senior Machine Learning Platform Engineer,NY,Stability AI,"$130,000 - $190,000 a year",,"(Location: Remote US)

About role:
We are currently looking for a skilled Sr. ML Platform Engineer with specialized focus on Cloud Infrastructure that includes API development to facilitate seamless integration and interaction between cloud-based services and High-Performance Computing (HPC) environments. The successful candidate will play a pivotal role in designing and implementing APIs that enable efficient communication and data exchange between cloud platforms and HPC systems.
Responsibilities:
Design, develop, and maintain robust APIs that facilitate communication and data exchange between cloud-based services, particularly AWS, and HPC environments
Collaborate with cross-functional teams to understand the unique requirements of both cloud based services and HPC systems, ensuring that the APIs developed meet the specific needs of these environments
Implement best practices for API design, including security, scalability, and performance optimization to ensure efficient interaction between cloud services and HPC clusters
Utilize services such as Cloudflare to enhance API performance, security, and reliability in the cloud-to-HPC communication, optimizing for speed and resilience
Work closely with HPC engineers to identify and address integration challenges, striving for seamless connectivity between diverse systems and cloud-based platforms
Drive innovation by proposing and implementing new API strategies, enhancing the efficiency and functionality of data exchange between AWS, Cloudflare workers, on-premise HPC environments
Create comprehensive documentation and provide training to internal teams on the use and integration of developed APIs, focusing on AWS and Cloudflare environments
Monitor API performance and address issues related to data transfer, ensuring reliability and consistent operation between AWS, Cloudflare, and HPC systems (Slurm/AWS HyperPod)
Collaborate with the security team to ensure that the APIs comply with industry standards and best practices for data privacy and protection, especially in AWS and Cloudflare environments
Participating in incident management and root cause analysis to improve system reliability
Build containers with REST APIs for Gen AI functionality and host them on AWS and Azure
Requirements:
8 years of experience in cloud computing, API development, and a deep understanding of High-Performance Computing environments, particularly in an AWS setting
Strong knowledge of HPC cluster management and job scheduling with Slurm and AWS HyperPod
Proficiency in programming languages such as Python and Typescript, essential for API development and integration within AWS and/or Cloudflare worker environments
Demonstrated expertise in API design, implementation, and maintenance, ensuring security and performance best practices within AWS and Cloudflare
Knowledge of containerization technologies (e.g., Docker, Kubernetes) for deployment of APIs within AWS, Cloudflare, and HPC systems
Experience with automating CI/CD pipelines
Familiarity with authentication and authorization protocols (e.g., OAuth, JWT) to ensure secure data exchange between AWS, Cloudflare, and HPC environments
Strong problem-solving skills and the ability to troubleshoot complex issues related to API integrations in a hybrid cloud-HPC setup, particularly in AWS and Cloudflare environments
Excellent communication and collaboration skills to work effectively with diverse teams and stakeholders in AWS and Cloudflare ecosystems
Compensation
The salary range for this role is between $130,000 and $190,000. Individual pay within the range is based on factors like job-related skills and experience. Total compensation also includes stock options and benefits
Equal Employment Opportunity:
We are an equal opportunity employer and do not discriminate on the basis of race, religion, national origin, gender, sexual orientation, age, veteran status, disability or other legally protected statuses. (Location: Remote US)

About role: We are currently looking for a skilled Sr. ML Platform Engineer with specialized focus on Cloud Infrastructure that includes API development to facilitate seamless integration and interaction between cloud-based services and High-Performance Computing (HPC) environments. The successful candidate will play a pivotal role in designing and implementing APIs that enable efficient communication and data exchange between cloud platforms and HPC systems. Responsibilities: Design, develop, and maintain robust APIs that facilitate communication and data exchange between cloud-based services, particularly AWS, and HPC environments Collaborate with cross-functional teams to understand the unique requirements of both cloud based services and HPC systems, ensuring that the APIs developed meet the specific needs of these environments Implement best practices for API design, including security, scalability, and performance optimization to ensure efficient interaction between cloud services and HPC clusters Utilize services such as Cloudflare to enhance API performance, security, and reliability in the cloud-to-HPC communication, optimizing for speed and resilience Work closely with HPC engineers to identify and address integration challenges, striving for seamless connectivity between diverse systems and cloud-based platforms Drive innovation by proposing and implementing new API strategies, enhancing the efficiency and functionality of data exchange between AWS, Cloudflare workers, on-premise HPC environments Create comprehensive documentation and provide training to internal teams on the use and integration of developed APIs, focusing on AWS and Cloudflare environments Monitor API performance and address issues related to data transfer, ensuring reliability and consistent operation between AWS, Cloudflare, and HPC systems (Slurm/AWS HyperPod) Collaborate with the security team to ensure that the APIs comply with industry standards and best practices for data privacy and protection, especially in AWS and Cloudflare environments Participating in incident management and root cause analysis to improve system reliability Build containers with REST APIs for Gen AI functionality and host them on AWS and Azure Requirements: 8 years of experience in cloud computing, API development, and a deep understanding of High-Performance Computing environments, particularly in an AWS setting Strong knowledge of HPC cluster management and job scheduling with Slurm and AWS HyperPod Proficiency in programming languages such as Python and Typescript, essential for API development and integration within AWS and/or Cloudflare worker environments Demonstrated expertise in API design, implementation, and maintenance, ensuring security and performance best practices within AWS and Cloudflare Knowledge of containerization technologies (e.g., Docker, Kubernetes) for deployment of APIs within AWS, Cloudflare, and HPC systems Experience with automating CI/CD pipelines Familiarity with authentication and authorization protocols (e.g., OAuth, JWT) to ensure secure data exchange between AWS, Cloudflare, and HPC environments Strong problem-solving skills and the ability to troubleshoot complex issues related to API integrations in a hybrid cloud-HPC setup, particularly in AWS and Cloudflare environments Excellent communication and collaboration skills to work effectively with diverse teams and stakeholders in AWS and Cloudflare ecosystems Compensation The salary range for this role is between $130,000 and $190,000. Individual pay within the range is based on factors like job-related skills and experience. Total compensation also includes stock options and benefits Equal Employment Opportunity: We are an equal opportunity employer and do not discriminate on the basis of race, religion, national origin, gender, sexual orientation, age, veteran status, disability or other legally protected statuses.",NY,https://www.indeed.com/rc/clk?jk=83a06e3e6a5cb299&bb=RWi7Ji1WXXmHfvMJ4NRhPPdKgxIlBDVcZEr8UTKh2GYe0VXfJkJCYK8QX_DCleEc9rc8sjFKU6BUM196mCjaXf5tHO8KXDeh8lLKJ_k2rIKgao3D0vnWGhtgXv3tOYBU&xkcb=SoCo67M37hE8CpgC870GbzkdCdPP&fccid=13f612179714481d&vjs=3
Python Developer,"New York, NY",Intellibee,,," 8+ years of experience in Python, PySpark, Hadoop Big Data
Build PySpark based applications for both batch and streaming requirements, which will require in-depth knowledge on majority of Hadoop and NoSQL databases as well. Optimize performance of the built Spark applications in Hadoop using configurations around Spark Context, Spark-SQL, Data Frame, and Pair RDD's. Should be skilled to use APIs in order to process huge datasets. They can run Spark/pyspark on open source frameworks such as Hadoop in the cloud with complicated data.
Develop, test and maintain high-quality software using Python programming language. Participate in the entire software development lifecycle, building, testing and delivering high-quality solutions. Collaborate with cross-functional teams to identify and solve complex problems.
Strong Backend development Experience in Python
Good Understanding of python libraries like Pandas, Polars, NumPy, Matplotlib, Plotly, Seaborn, Altair.
Conceptually Strong in Python and Analytics
Design and implement web applications using Python framework like Streamlit.
Design visualizations, custom widgets, and components, translate complex data processing and analysis tasks into intuitive, user-friendly web interfaces.
Collaborate with back-end developers to integrate APIs and databases with Streamlit applications.
Working with large data sets and incomplete information as required.
Working with users, business stakeholders, product owners /technology teams to deeply understand customer needs, develop solutions independently.
Experience of working in a financial organization or awareness of financial concepts especially related to Trading hub.
Rewrite and decom legacy controls: consider a python framework for converting RBS Java for scenarios outside Trading Hub and BABS to transition all remaining legacy RBS scenarios to new Surveillance capabilities.
Skill set: Python, PySpark, Hadoop Big Data, Java 8+ years of experience in Python, PySpark, Hadoop Big Data
Build PySpark based applications for both batch and streaming requirements, which will require in-depth knowledge on majority of Hadoop and NoSQL databases as well. Optimize performance of the built Spark applications in Hadoop using configurations around Spark Context, Spark-SQL, Data Frame, and Pair RDD's. Should be skilled to use APIs in order to process huge datasets. They can run Spark/pyspark on open source frameworks such as Hadoop in the cloud with complicated data.
Develop, test and maintain high-quality software using Python programming language. Participate in the entire software development lifecycle, building, testing and delivering high-quality solutions. Collaborate with cross-functional teams to identify and solve complex problems.
Strong Backend development Experience in Python
Good Understanding of python libraries like Pandas, Polars, NumPy, Matplotlib, Plotly, Seaborn, Altair.
Conceptually Strong in Python and Analytics
Design and implement web applications using Python framework like Streamlit.
Design visualizations, custom widgets, and components, translate complex data processing and analysis tasks into intuitive, user-friendly web interfaces.
Collaborate with back-end developers to integrate APIs and databases with Streamlit applications.
Working with large data sets and incomplete information as required.
Working with users, business stakeholders, product owners /technology teams to deeply understand customer needs, develop solutions independently.
Experience of working in a financial organization or awareness of financial concepts especially related to Trading hub.
Rewrite and decom legacy controls: consider a python framework for converting RBS Java for scenarios outside Trading Hub and BABS to transition all remaining legacy RBS scenarios to new Surveillance capabilities.
Skill set: Python, PySpark, Hadoop Big Data, Java 8+ years of experience in Python, PySpark, Hadoop Big Data
Build PySpark based applications for both batch and streaming requirements, which will require in-depth knowledge on majority of Hadoop and NoSQL databases as well. Optimize performance of the built Spark applications in Hadoop using configurations around Spark Context, Spark-SQL, Data Frame, and Pair RDD's. Should be skilled to use APIs in order to process huge datasets. They can run Spark/pyspark on open source frameworks such as Hadoop in the cloud with complicated data.
Develop, test and maintain high-quality software using Python programming language. Participate in the entire software development lifecycle, building, testing and delivering high-quality solutions. Collaborate with cross-functional teams to identify and solve complex problems.
Strong Backend development Experience in Python
Good Understanding of python libraries like Pandas, Polars, NumPy, Matplotlib, Plotly, Seaborn, Altair.
Conceptually Strong in Python and Analytics
Design and implement web applications using Python framework like Streamlit.
Design visualizations, custom widgets, and components, translate complex data processing and analysis tasks into intuitive, user-friendly web interfaces.
Collaborate with back-end developers to integrate APIs and databases with Streamlit applications.
Working with large data sets and incomplete information as required.
Working with users, business stakeholders, product owners /technology teams to deeply understand customer needs, develop solutions independently.
Experience of working in a financial organization or awareness of financial concepts especially related to Trading hub.
Rewrite and decom legacy controls: consider a python framework for converting RBS Java for scenarios outside Trading Hub and BABS to transition all remaining legacy RBS scenarios to new Surveillance capabilities.
Skill set: Python, PySpark, Hadoop Big Data, Java 8+ years of experience in Python, PySpark, Hadoop Big Data Build PySpark based applications for both batch and streaming requirements, which will require in-depth knowledge on majority of Hadoop and NoSQL databases as well. Optimize performance of the built Spark applications in Hadoop using configurations around Spark Context, Spark-SQL, Data Frame, and Pair RDD's. Should be skilled to use APIs in order to process huge datasets. They can run Spark/pyspark on open source frameworks such as Hadoop in the cloud with complicated data. Develop, test and maintain high-quality software using Python programming language. Participate in the entire software development lifecycle, building, testing and delivering high-quality solutions. Collaborate with cross-functional teams to identify and solve complex problems. Strong Backend development Experience in Python Good Understanding of python libraries like Pandas, Polars, NumPy, Matplotlib, Plotly, Seaborn, Altair. Conceptually Strong in Python and Analytics Design and implement web applications using Python framework like Streamlit. Design visualizations, custom widgets, and components, translate complex data processing and analysis tasks into intuitive, user-friendly web interfaces. Collaborate with back-end developers to integrate APIs and databases with Streamlit applications. Working with large data sets and incomplete information as required. Working with users, business stakeholders, product owners /technology teams to deeply understand customer needs, develop solutions independently. Experience of working in a financial organization or awareness of financial concepts especially related to Trading hub. Rewrite and decom legacy controls: consider a python framework for converting RBS Java for scenarios outside Trading Hub and BABS to transition all remaining legacy RBS scenarios to new Surveillance capabilities. Skill set: Python, PySpark, Hadoop Big Data, Java","New York, NY",https://www.indeed.com/rc/clk?jk=e92c2abdfa0211ce&bb=yPbE1wXDyaenAjCmdMBIkiKFJR18mUbKEpsmMTuQWXVgZV4SsjzCxEFDjF1nDCvlVjo8QmTbT-2T4YkuKDivj96nqFYRbZq3X3TNmya-Qcxu3hlTInh_DJRYgcZ7Z2Ll&xkcb=SoD667M37o61RozS4p0LbzkdCdPP&fccid=d99d618a0bcbc8ee&vjs=3
