Job Title,Location,Company Name,Pay,Job Type,Description,Location or Zipcode,href
Kore. Ai Developer,"Malvern, PA",N/A,$35 - $50 an hour,Full-time,N/A,,https://www.indeed.com/viewjob?cmp=Genesis-Tech-Solutions-Pvt-Limited&t=Developer&jk=ce204178892be3c6&q=kore.ai&xpse=SoCc67I37UMdcwXYq50LbzkdCdPP&xfps=20f18706-8a4c-42f3-ad95-fc8d5e31ecc4&xkcb=SoAi67M37UMeGP3fpJ0KbzkdCdPP&vjs=3
Machine Learning Engineer II,NY,Uber,"$158,000 - $175,500 a year",Full-time,"About the Role

The Ads Machine Learning (Ads ML) team at Uber is responsible for providing relevant ad recommendations to the users across the different applications within the Uber ecosystem. We focus on building a deep understanding of both user and merchant behavior to generate accurate ML signals that enhance the Ads auction system. Our goal is to maximize the benefits for both users and merchants within Uber's Ads distribution system.

You will directly impact Uber's Ads systems by defining and executing the Ads ML roadmap, with a focus on enabling and accelerating large-scale improvements to our recommendation systems. Developing relevant, robust, and observable ad recommendations is crucial to Uber's fast growing Ads Business strategy, making this a highly impactful role. - What the Candidate Will Do -
Design and implement machine learning models and algorithms to optimize ad recommendations and auction mechanisms.
Apply advanced statistical and machine learning techniques to generate insights and improve the effectiveness of ad targeting and delivery.
Monitor and ensure the reliability of ML Predictions at large scale.
Stay up-to-date with the latest research and advancements in machine learning, recommendation systems, and ad auction techniques.
- Basic Qualifications -
Bachelor's degree or equivalent experience in Computer Science, Computer Engineering, Data Science, ML, Statistics, or other quantitative fields.
Proven experience with designing and implementing machine learning models in production environments applied to recommendation systems.
Proficiency in using Python for developing ML models and handling large-scale data sets.
Hands-on experience with building batch data pipelines using technologies like Spark or other map-reduce frameworks.
- Preferred Qualifications -
2 years of industry experience as an ML engineer or equivalent.
Experience with enabling production-scale and debugging large ML models.
Experience in one or more object-oriented programming languages (e.g. Python, Go, Java, C++).
Advanced degree (Ph.D. or M.S.) in Data Science, ML, or related disciplines.


For New York, NY-based roles: The base salary range for this role is USD$158,000 per year - USD$175,500 per year. For San Francisco, CA-based roles: The base salary range for this role is USD$158,000 per year - USD$175,500 per year. For all US locations, you will be eligible to participate in Uber's bonus program, and may be offered an equity award & other types of comp. You will also be eligible for various benefits. More details can be found at the following link https://www.uber.com/careers/benefits. Design and implement machine learning models and algorithms to optimize ad recommendations and auction mechanisms. Apply advanced statistical and machine learning techniques to generate insights and improve the effectiveness of ad targeting and delivery. Monitor and ensure the reliability of ML Predictions at large scale. Stay up-to-date with the latest research and advancements in machine learning, recommendation systems, and ad auction techniques. Bachelor's degree or equivalent experience in Computer Science, Computer Engineering, Data Science, ML, Statistics, or other quantitative fields. Proven experience with designing and implementing machine learning models in production environments applied to recommendation systems. Proficiency in using Python for developing ML models and handling large-scale data sets. Hands-on experience with building batch data pipelines using technologies like Spark or other map-reduce frameworks. 2 years of industry experience as an ML engineer or equivalent. Experience with enabling production-scale and debugging large ML models. Experience in one or more object-oriented programming languages (e.g. Python, Go, Java, C++).",NY,https://www.indeed.com/rc/clk?jk=2450dac351d867a4&bb=0VgmyNjgbnOJE71-7xOwo-z2ptbeYBqqCEJTnqrDgRiAM8zVULTQpTCxlPmbzvh2-xACaeD3IvwkCLLQfKJi5JmCIG1D7pxm_3BeKdbRTaMGThWyKCcCtrergKNJlUDF&xkcb=SoCt67M37hEoC-AC9T0LbzkdCdPP&fccid=f766f8bfbc3effb7&vjs=3
Machine Learning Engineer - Apple MT service,NY,Apple,"$143,100 - $264,200 a year",,"Summary

Posted: Sep 19, 2024

Role Number:200564680

Play a part in the next revolution in human-computer interaction. Build groundbreaking technology to make Apple Intelligence available in different culture and regions worldwide. The AI/ML - Machine Translation team is looking for machine learning engineer passionate about delighting customer’s experience and pushing the envelope on AIML technologies, data quality and system efficiency.

Description

You will be a part of a team that's responsible for a wide variety of language technologies related research and development activities. Your focus will be on developing ML solutions and automation pipelines to generate high quality domain and locale specific data for Apple Intelligence language expansion. You should be passionate about creating phenomenal products that are used by millions of people. You’re expected to be a team player who thrives in a fast paced environment with rapidly changing priorities.
In-depth ML/DL knowledge and experience in LLM, MT, NLP, model QE etc
Familiarity with relevant toolkits such as pyTorch, JAX, etc.
Strong software engineering skills with expert level proficiency in one of the programming languages: Python, C/C++, shell scripting, java, etc.
Solid hands-on experience in cloud computing and large distributed systems
Experience in data curation, ML system efficiency a big plus
M.S. or PhD in Computer Science or related field

Preferred Qualifications
Experience with data curation
Experience with data management
Experience with ML system efficiency
Experience with Large distributed systems
Familiarity with relevant toolkits such as pyTorch, JAX, etc.
Fast learner and strong motivation on growing and learning new technologies

Pay & Benefits
At Apple, base pay is one part of our total compensation package and is determined within a range. This provides the opportunity to progress as you grow and develop within a role. The base pay range for this role is between $143,100 and $264,200, and your base pay will depend on your skills, qualifications, experience, and location. Apple employees also have the opportunity to become an Apple shareholder through participation in Apple’s discretionary employee stock programs. Apple employees are eligible for discretionary restricted stock unit awards, and can purchase Apple stock at a discount if voluntarily participating in Apple’s Employee Stock Purchase Plan. You’ll also receive benefits including: Comprehensive medical and dental coverage, retirement benefits, a range of discounted products and free services, and for formal education related to advancing your career at Apple, reimbursement for certain educational expenses - including tuition. Additionally, this role might be eligible for discretionary bonuses or commission payments as well as relocation. Learn more about Apple Benefits. Note: Apple benefit, compensation and employee stock programs are subject to eligibility requirements and other terms of the applicable plan or program.

More
Apple is an equal opportunity employer that is committed to inclusion and diversity. We take affirmative action to ensure equal opportunity for all applicants without regard to race, color, religion, sex, sexual orientation, gender identity, national origin, disability, Veteran status, or other legally protected characteristics. Learn more about your EEO rights as an applicant. In-depth ML/DL knowledge and experience in LLM, MT, NLP, model QE etc Familiarity with relevant toolkits such as pyTorch, JAX, etc. Strong software engineering skills with expert level proficiency in one of the programming languages: Python, C/C++, shell scripting, java, etc. Solid hands-on experience in cloud computing and large distributed systems Experience in data curation, ML system efficiency a big plus M.S. or PhD in Computer Science or related field Experience with data curation Experience with data management Experience with ML system efficiency Experience with Large distributed systems Familiarity with relevant toolkits such as pyTorch, JAX, etc. Fast learner and strong motivation on growing and learning new technologies Apple is an equal opportunity employer that is committed to inclusion and diversity. We take affirmative action to ensure equal opportunity for all applicants without regard to race, color, religion, sex, sexual orientation, gender identity, national origin, disability, Veteran status, or other legally protected characteristics. Learn more about your EEO rights as an applicant.",NY,https://www.indeed.com/rc/clk?jk=ab8f75d59ba4bc5c&bb=0VgmyNjgbnOJE71-7xOwo7XlhGxQ2t1qgZZPkpXmaTpnB9xZvE8t7dmk-lSSBiXe_epXkV9Knh3lftbQh-5OOCwtDq0iUcGpNUkjfl_cHqXe_UwFe73G8Q%3D%3D&xkcb=SoAZ67M37hEoC-AC9T0KbzkdCdPP&fccid=c1099851e9794854&vjs=3
Sr. Machine Learning Engineer,NY,CVS Health,"$111,240 - $222,480 a year",Full-time,"Bring your heart to CVS Health. Every one of us at CVS Health shares a single, clear purpose: Bringing our heart to every moment of your health. This purpose guides our commitment to deliver enhanced human-centric health care for a rapidly changing world. Anchored in our brand — with heart at its center — our purpose sends a personal message that how we deliver our services is just as important as what we deliver.

Our Heart At Work Behaviors™ support this purpose. We want everyone who works at CVS Health to feel empowered by the role they play in transforming our culture and accelerating our ability to innovate and deliver solutions to make health care more personal, convenient and affordable.
Position Summary
Do you want to be at the forefront of one of the most exciting and visible applications of Gen AI and machine learning at CVS Health? We are seeking seasoned and high performing data scientist to join Iris team. Iris an existing in-house RAG (retrieval augmented generation) solution that provides automated answers to health insurance questions that our members have. Iris is currently live for customer service representative (CSR) users within Aetna's call center, where is driving significant call duration savings and great user feed-back, but its vision is to become a intelligent member facing bot powering CVS self- servicing channels. This role requires someone who is willing to become a subject matter expert on customer service practices - the best way to create a tool that serves users is to think like a user and become deeply familiar with their pain points. You will work extensively with the A&BC data engineering team, product team, and business (Service Operations) to establish requirements, design enhancements, implement them or coordinate implementation with DE, evaluate performance, and measure impact.
As Senior ML Engineer, you will be responsible for
1. Developing new features (e.g. question classification, driving the vision for making Iris member-facing in YAVA/AH, designing how the chat experience functions, summarization/simplification)
2. Ensuring accuracy (e.g. diagnosing product feedback and identifying fixes, improving benefit search, improving search strategy, prompting, codifying business practices with advanced analytics, ML, or gen AI)
3. Working on new data source integration
4. Measuring product performance, usage patterns, and impact
Required Qualifications
3+ years of hands-on experience in data analysis, machine learning, and deep learning
3+ years experience in statistical analysis and experiment design
Strong proficiency in SQL and Python, including experience with essential packages such as scikit-learn (sklearn), matplotlib, pandas, seaborn, PyTorch, Hugging Face, and OpenAI
3+ years experience documenting, synthesizing, and communicating results at all levels of the
Preferred Qualifications
Experience building and evaluating data products with gen AI
Experience with natural language processing - classification (sequence/token), information retrieval (dense/sparse search), and regex
Familiarity navigating GCP - GCS, Big query, Big table, data proc.
Experience working with non-technical stakeholders to establish business requirements for undefined requests
Excellent communication and presentation skills, with the ability to work effectively with cross-functional teams and manage stakeholders
Experience with Generative AI, LLM, and NLP
Full Stack Data Science experience is a plus
Education
Bachelor's degree in Applied Mathematics, Computer Science, Physics, Engineering, or equivalent quantitative field.
Master's degree or PhD preferred
Pay Range
The typical pay range for this role is:
$111,240.00 - $222,480.00
This pay range represents the base hourly rate or base annual full-time salary for all positions in the job grade within which this position falls. The actual base salary offer will depend on a variety of factors including experience, education, geography and other relevant factors. This position is eligible for a CVS Health bonus, commission or short-term incentive program in addition to the base pay range listed above.

In addition to your compensation, enjoy the rewards of an organization that puts our heart into caring for our colleagues and our communities. The Company offers a full range of medical, dental, and vision benefits. Eligible employees may enroll in the Company’s 401(k) retirement savings plan, and an Employee Stock Purchase Plan is also available for eligible employees. The Company provides a fully-paid term life insurance plan to eligible employees, and short-term and long term disability benefits. CVS Health also offers numerous well-being programs, education assistance, free development courses, a CVS store discount, and discount programs with participating partners. As for time off, Company employees enjoy Paid Time Off (“PTO”) or vacation pay, as well as paid holidays throughout the calendar year. Number of paid holidays, sick time and other time off are provided consistent with relevant state law and Company policies.

For more detailed information on available benefits, please visit Benefits | CVS Health
We anticipate the application window for this opening will close on: 10/02/2024
Qualified applicants with arrest or conviction records will be considered for employment in accordance with all federal, state and local laws. Bring your heart to CVS Health. Every one of us at CVS Health shares a single, clear purpose: Bringing our heart to every moment of your health. This purpose guides our commitment to deliver enhanced human-centric health care for a rapidly changing world. Anchored in our brand — with heart at its center — our purpose sends a personal message that how we deliver our services is just as important as what we deliver.

Our Heart At Work Behaviors™ support this purpose. We want everyone who works at CVS Health to feel empowered by the role they play in transforming our culture and accelerating our ability to innovate and deliver solutions to make health care more personal, convenient and affordable.  Position Summary Do you want to be at the forefront of one of the most exciting and visible applications of Gen AI and machine learning at CVS Health? We are seeking seasoned and high performing data scientist to join Iris team. Iris an existing in-house RAG (retrieval augmented generation) solution that provides automated answers to health insurance questions that our members have. Iris is currently live for customer service representative (CSR) users within Aetna's call center, where is driving significant call duration savings and great user feed-back, but its vision is to become a intelligent member facing bot powering CVS self- servicing channels. This role requires someone who is willing to become a subject matter expert on customer service practices - the best way to create a tool that serves users is to think like a user and become deeply familiar with their pain points. You will work extensively with the A&BC data engineering team, product team, and business (Service Operations) to establish requirements, design enhancements, implement them or coordinate implementation with DE, evaluate performance, and measure impact. As Senior ML Engineer, you will be responsible for 1. Developing new features (e.g. question classification, driving the vision for making Iris member-facing in YAVA/AH, designing how the chat experience functions, summarization/simplification) 2. Ensuring accuracy (e.g. diagnosing product feedback and identifying fixes, improving benefit search, improving search strategy, prompting, codifying business practices with advanced analytics, ML, or gen AI) 3. Working on new data source integration 4. Measuring product performance, usage patterns, and impact  Required Qualifications 3+ years of hands-on experience in data analysis, machine learning, and deep learning 3+ years experience in statistical analysis and experiment design Strong proficiency in SQL and Python, including experience with essential packages such as scikit-learn (sklearn), matplotlib, pandas, seaborn, PyTorch, Hugging Face, and OpenAI 3+ years experience documenting, synthesizing, and communicating results at all levels of the Preferred Qualifications Experience building and evaluating data products with gen AI Experience with natural language processing - classification (sequence/token), information retrieval (dense/sparse search), and regex Familiarity navigating GCP - GCS, Big query, Big table, data proc. Experience working with non-technical stakeholders to establish business requirements for undefined requests Excellent communication and presentation skills, with the ability to work effectively with cross-functional teams and manage stakeholders Experience with Generative AI, LLM, and NLP Full Stack Data Science experience is a plus  Education
Bachelor's degree in Applied Mathematics, Computer Science, Physics, Engineering, or equivalent quantitative field.
Master's degree or PhD preferred  Pay Range The typical pay range for this role is:   This pay range represents the base hourly rate or base annual full-time salary for all positions in the job grade within which this position falls. The actual base salary offer will depend on a variety of factors including experience, education, geography and other relevant factors. This position is eligible for a CVS Health bonus, commission or short-term incentive program in addition to the base pay range listed above.

In addition to your compensation, enjoy the rewards of an organization that puts our heart into caring for our colleagues and our communities. The Company offers a full range of medical, dental, and vision benefits. Eligible employees may enroll in the Company’s 401(k) retirement savings plan, and an Employee Stock Purchase Plan is also available for eligible employees. The Company provides a fully-paid term life insurance plan to eligible employees, and short-term and long term disability benefits. CVS Health also offers numerous well-being programs, education assistance, free development courses, a CVS store discount, and discount programs with participating partners. As for time off, Company employees enjoy Paid Time Off (“PTO”) or vacation pay, as well as paid holidays throughout the calendar year. Number of paid holidays, sick time and other time off are provided consistent with relevant state law and Company policies.

For more detailed information on available benefits, please visit Benefits | CVS Health   Qualified applicants with arrest or conviction records will be considered for employment in accordance with all federal, state and local laws. ",NY,https://www.indeed.com/rc/clk?jk=d832bbdcc97a3b0f&bb=0VgmyNjgbnOJE71-7xOwo3ymNtbAFcphmQZ5ZCeaQCuAza6fxsrjQvSU-8j9JGJD_WlkM-ZrBaM_CrUC12KlLJ7SqG50Ln8tHpVfQrbFX6IHzARJ1Rf2Ug%3D%3D&xkcb=SoCE67M37hEoC-AC9T0JbzkdCdPP&fccid=be3b11aa573faee7&vjs=3
